word_0, word_2, count_0, count_2, top_0, top_2, head_count_0, head_count_2, num_mutual, mutual heads, num_unique_2, unique_2_heads
black,blackened,15302,63,pepper,steel,3793,52,31,steel silver skin door sphere shrimp circle trees socks earrings metal glass neck stuff heart hole deal face chips roofs ceiling shells clouds year mass faces hands jelly boulders rings hulls,21,filet brisket needles propaganda penne carparks shipping salmon swath barrels steak octopus husk wildfires hulk pans swoosh birch tilapia chicken complex
clean,cleaned,6506,257,water,carpets,1878,178,103,carpets steam offices house gutters time finish surfaces area material home surface way parts bowl ducts look roof face items components state vents exterior rugs jobs code fingers carpet quality car filters work body skin mattress textiles place cleaning have rooms facilities grout fabrics drives part patterns property unit shapes signs date activities days spaces remains ones greenhouse clothes carpeting coating cover lines mix bathrooms apartment caps environment houses company files ball things knowledge kind toilets mattresses piece boots materials particles air tube shop floor environments hair water equipment frame data sink mussels version napkin building shells center case furniture upholstery vehicles shape,75,curtains coins establishments cleared Cladding Note ductwork CMDs cartridges assistant rumble laptop armpits fee flue toys root coin cuttlefish claim mechanic notice availability basins XF40 rice neck fire ebi domains goods barrel freshman Bathroom roofs pics саn polyester flour stock visits cans fans places establishment endoscopes Grill news cause suggestions blinds wall springs linkages courtesy blood number mother lessons smoothed blunder SEED pile leaves jobber scale tires Textiles RMB articles drains star grooves cage chef
clear,cleared,9697,233,understanding,payment,2381,172,87,area payment lot funds areas paths time path effort way table trails trees procedure corner land track control decision end brush person ability business beach sense visibility therapy girl announcements cream place space trend customs process cache statement television system fact operation application site question traffic clue position road chamber coating man file gutters phone right advantage fields firm oil level chance driveway reason performance sale skies places security cases people job detail ground obstructions drains stay surprise walkways claims trail condition incidents night treatment rights bases,85,students forest Applicants device cross weeks teammate camps app series cd rock trunks clouds exam cleaning probe slice settlers agencies min swamp scene oximeter park competition queries modes reliever engineers leupeptin seekers apps hilltops acres banks hill wonder lysate committee drain sail Trip und ton claim CEO yards Courses recipients officials Inbox purchases shipments confusion aspirants medications beliefs driveways pewter months GWe others equipment balances weapon Refugees cleared abe vegetation opens garden fertilizer candidates reform rink plantation balance -on districts pts circumstances pond group auction
cool,cooled,5958,205,place,air,1906,127,43,air mixture cookies water seats cakes cupcakes soil technology camera conditioning head summers spring store brownies bags degrees Eggplant area feature sugar condition options machine space tubing compartment rooms mix smoke pattern power cups layer foods ball frost bag temperature lakes air-conditioning use,84,cake ingot tea wort layers ccm engine crust butter macaroons cupcake rollers cows Liquid manifold coffee onion rice rolls custard sunshine spectrometer liquid cells patio CCD reactor sensor slice SBCs detector min fears coupons fillet waffles condenser pie operating controversies instructions cooling beetroot fondant CPU puree noodles chamber intake drawers beers circulation oil roll conservatories pm bacon coconut apricots array headphones Things dough improved milk convection shortbread motor cylinder vegetables pedestal accessoriesparts rivals stator exchangers superconductors linzer blades syrup watwr blueberries potatoes meat instruments
deep,deepen,8505,72,breath,ways,2330,45,27,ways time way ideas work need features things tradition opportunities model skill topics projects voices exercises recession designs space people drive information part memories events sessions calls,18,opportunity efforts chance balance effort goals plan datasets ingredients will reads nonsense effects steps programme activities lure variations
dirty,dirtied,1161,5,work,stirrup-pants,516,5,0,,5,vox stirrup-pants problems grouting jacket
dry,dried,5776,1207,skin,fruit,1464,427,162,fruit fruits herbs beans leaves fish flowers figs ones ginger blood lavender food shrimp seeds hair thyme dates pasta products basil product grass skin boards mint goods foods corn leaf grains milk flower layer items noodles slices yeast vegetables form sand tea wood basis apples herb weight pieces air chilies whites ground powder cans meat kiln pulp white almonds earth nuts chili ingredients clothes surfaces spots residue mud onion cut lips wheat curry notes skins straws bars rice areas peppermint debris towel other towels paste material grounds plant chain glue sun crumbs manner cream peels place cleaning spice slice dirt storage bait substance days gas seafood cost sheets seasoning trees variant cave face road extract glitter components fit oak wall factory mass environment meals samples matter phase made section oil snack surface branch stuff timber strips materials juice machine ham kale spices lumber mixture grease one bread way day roots blend point version heads seed brine amount production flesh variety plants week,265,cranberries cherries apricots tomatoes mushrooms flakes pods chiles prunes oregano sage peas blueberries petals berries parsley mango specialities meats coconut pepper chillies currants tomato apricot cannabis grain flavours bud seasonings plums seaweed chilli peel rosemary bouquet grapes olives hops scallop chickpeas root dill lemon tobacco kelp mushroom raspberries Blueberries wrappers applied rings berry garlic porcini stains flavors pineapple sambal strawberries weeds honey raw cheese case panels angelica hederacea palms cloves morels impact sweat diets yoghurt shallot dried blank cones cherry soup roses mangoes fluid buds packs vases tepins leather differences tears truffle Materials sultanas Clay Grill рlаnt hemp corpse greenery parawood Whale nettles moccasins algae artichokes potato answers characters oyster reasons garland shallots lumbers shreds fillet monte skeletons testing stuffing forage lovage rеfеrs cakes botanicals gongura measurement baits package cubes luteus worm groups lung apple bugs chips blossoms seedlings Cloves egg pod cheesecake creepers kolbász cooled hay husk droplets chickpea vial dices power hardwood vine peat electrophoresis willow shikakai candy turmeric weed visual epazote scars making vinaigrette smoking anchovies firm fields choy plum longans foliage eggs plankton batik toatoes cod zest hue ﬂowers combo piece wreaths Raspberries pea bone peaches harpoon bloom moss cats citrus Onions nourishment wax maqui defect compared bunches salami arrangements floor crook aerogels matrix mulberries Loctite cornstalks poly DNA considered coconuts evils lilies lvs faeces caramel wildflowers pumpkin anemone husks melon yarrow onions ladies cranberry ether sumac barberries legumes bloodworms broccoli toothpaste Specimens mealworms silicone shells coloring pesto zahter putty heritage cubensis pine penguins Lots syrup rind plantain dollars lentil potatoes chlorine bundle pill Basil oranges focaccia butterflies definition chillis lavendar
hard,enlarged,13528,288,work,pores,2293,170,59,view version image edition section scale heart group images capital fact time area size access spaces things scales sheets one impact film plates plate leadership surface person text versions form experience deck details face lenses boundaries condition bay areas kitchen team room space place bodies year power number checks company box object catalogue look print selection date discussion bed,111,pores prostate veins portion tonsils node ovary breasts nodes picture ventricles aorta panel photo volume nuclei spleen regions turbinates gastrojejunostomy sinuses follicles photographs guard opening Theatre gland photos pronephros frenulum Bandwidth MVBs delaybetween roadster suite showroom hulls insignia syndrome photograph model remains terminus trains adenoma region desk l coalition cross-section hinges pictures vents MEs intake title uterus portico reproduction pedipalps liver matchbook powers mesosoma parking opportunities thumbstuds circumference eye plan backyard earnings abdomen cavity buildings included flames woodlawn church Union lodge tube stomach adenoids island microfossils university claw villas callusses Photos ventricle patios tooth facility sinusoids faculty heads membership station charm -stars discs airbase pedals clip organs gums spoiler manifestations vasculature
large,hardened,35242,252,number,steel,5344,181,90,steel heart blade cholesterol blades system soldiers plates wheels parts material balls layer plastic deposits fan texture muscles type profile jaws depth screws shaft rocks paper compound work stance battle rock edge bodies ash phones process part structure sleeve platforms window rollers glass sausages face man packages matter measures casing products pin followers sure surface soul stains lump materials pieces designs zone particles people target tubes lens flow recipe cylinder content tool outcomes cake rack term condition castings areas bolts windows tycoons guide discs base mound washer pressure cutter bases,91,criminals criminal glue gears shank edges skin plaque steels shackle impulse exterior torment finish hearts shelters snow warriors demeanor switch barrier phlegm sugar likelihood optics perception message drinkers maturity race sebum i7 hooligans bile missiles bushing microstructure filler critics atheist magma clay youngsters blobs receiver concretes mud carbon seedling paddles reader contraptions walkers insert bevel targets experts veterans detective skulls air veteran interrogator laner pro plastics distribution grease plaster titanium razor-cut carbide caramel defenses seafarers filaments sauce believers lava sinners negotiators passengers coders resin smoker maximum girlfriend flesh MDF aluminum metals
long,lengthened,32125,15,time,periods,3873,14,8,periods form runway version match answers intervention deadlines,6,shield statutes shortened borrowing telomeres Automation
red,reddened,11498,13,wine,eyes,2756,9,9,eyes skin areas orange tomatoes gums nose base cheeks,0,
sharp,sharpened,2307,70,knife,weights,855,50,27,knife blades blade skills scissors work edges edge side stick focus time tool tip handling surface hook glass opinion poles objects memory wings perception tang message sword,23,weights pencil pencils fourth fact genesis scrapper strategy customers faculty liner affair rapiers progress advisor place Note program breeze subtlety ground steel Cajun
short,shortened,18332,183,term,version,2742,107,74,version form URL season period links time URLs span hours game muscles unit name lifespan route word life ends length event forms week edit url schedule frame training system fact breaths course one day timeline way bar spring text versions reference term sentence borrowing account series face breaks cycle weekend team trousers lives guide stays role races chin amount title programs drive years weeks wheelbase campaign scale survival muscle times terms legs distance days,33,devices remainder yields telomeres Beetroot pads Abstract bouquet barrel slang radiofrequency horn nave respawn centerbodies Diploma machine ˌ state Melee workweeks injury bridegroom antennas URLS tower approaches beam renewals daylight tissues successor triathlon
smooth,smoothed,3952,28,transition,data,1290,24,14,data version stones ceilings system skin beach concrete function end piece functions surface color,10,forehead firm observations strengthened furrows awareness reducers disagreements lawn flavours
soft,softened,7285,87,cushions,butter,2069,50,25,butter cheese wood paper water seeds vegetables quality course material version warmth appearance edges haze movement brand memory pieces fruit tannins notes upholstery activity blue,25,pie sentiment countries standards groups sample increases mystery threat punch friezes gelatine stick skies noodles square concrete title cooking toughened doeskin broccolini prepreg beams rosehips
straight,straightened,3078,12,line,hair,1052,8,5,hair teeth point edge types,3,coils length tresses
strength,strengthened,392,137,training,partnership,301,116,9,system durability position experience glass challenges player building base,107,partnership forces relationships capacity shelves relationship legislation economy movement areas voice gunners alignment outline laws deck squad sense puissance methods justice transformation preconditions requirements backlog foundations cooperative enforcement steels collagen spine tissue structure yen times dollar almsgiving school fact budget filler policies beauty chips reminder ESM faith team published protection program statesman insult company riches fibers presence section care decades plates exile iron recipients performance stages pylons majorities wings suspension binder doubt connection deepen referrals tube portfolio concert graphite alloy ways capital lesson blockade form interrelationship sheet rivals belief polarization bond practice contrary workers utilize arms joists rims frontiers apparitions programs wheelchair improvement education industry rights nuance
sweet,sweetened,6036,148,potatoes,milk,1733,72,38,milk beverages cream tea drinks products cranberries coconut beans puree bar vinegar drink juice fact chocolate paste pilaf bars rice blend musk apple flavor chestnuts sugar filling flour pickles cheese melodies center dough cookies yogurt drizzle juices recipe,34,Tea sago currants cereal cola cocoa flakes slaw dried gum natural colas cond fluids zest gluten egg lemonade cereals ricotta paleo granola pot whisky conclusion tea’s answers flours Products DIETS cacao Cheesecake syrups pan-sauce
tight,tighten,2416,54,end,wrench,755,47,15,chance time idea collar twist skin fitting bid plan square process lines muscles one need,32,wrench campaign ways straps expectations decision protrusions instrument suggestion means confidence ability amortization cuffs eligibility options counterclockwise moisturise loosen perspiration screw Tights cleanse dials attempt screws drawstring moves steps bill tendency tools
tough,toughened,3389,40,time,glass,996,24,4,glass skin plastic material,20,screen cores ceramics rubber walls facility fronts interior feats barriers splashback sizes glassware splashbacks shelves piping motivation top states roof
warm,warmed,6177,82,water,milk,1449,64,39,milk tortillas cream oil plate heart areas bowls bread pancake things oils flatbread plates lotion pita sauce version holiday oven face chips honey room air broth mix syrup year butter hearts mittens leaves beaches dish world discussion water story,25,crystals applesauce pots veggies result yolks beeswax mugs greenhouse sugar contentions disagreement slabs lightning juice pjs tubing journey adjustments add variety systems mead spread wheel
weak,weakened,1678,163,points,system,792,103,48,system systems people state side demand economy areas muscles dollar leaders body bodies tone market sentiment unions support joints confidence standards opinion performance regulations ties condition digestion party strands team foundation security animals news structures government stimuli clubs price factors muscle euro comparison sectors gums value flow strength,55,period Trees timbers cornea evils ryan victims section advantages competitors marginalization ecosystem ligaments tendon bills revelation wavelengths types trees result ability Pact Parliament cells version distress squad USD witness targets dogs law tears transfer pieces germ situations doubt foes forces incident valves pack sphincter sites immunity ageing tissue pipes plastic week lenders cerebellum shelf strain
white,whitened,18518,11,black,cupboard,3735,11,10,effect sheets colour skull category cupboard strips flour jacket roof,1,doorsteps
wide,widened,16093,42,range,area,1935,40,28,eyes area section µm shots responsibilities countries eye driveway view sidewalks hole birth nozzle range door blade techniques shoulder access stretch ends systems slot shoulders doors top gap,12,level scars pronotum deficit votes quarters portions accessibility loss tools genera partner
