word, count, top, head_count, heads
dry,5776,skin,1464,skin ingredients season cleaning hair place mouth eye conditions weather food weight land air scalp . cloth fruits wine eyes cool powder matter areas climate ice patches heat goods shampoo cleaners time soil ground wood hands spell dock day mix storage warm rot clothes climates wall material wet area clean cough cleaner brush finish spots leaves lips process mixture syndrome pat services days let run environment side feet summers drowning milk grass foods yeast seasons pan symptoms formula summer surface months keep bed laundry spells towel grinding ones use sauna wash rub location periods allow pack herb machine bones places
large,35242,number,5344,number amount bowl part amounts area room numbers size selection companies group variety scale groups quantities windows areas portion range pot projects pan percentage pool corporations family volumes collection company kitchen skillet space deck extent businesses files volume population table proportion quantity rooms majority project cities piece garden screen saucepan community organizations sums lot island base tree bedroom window events bag closet network role capacity display parts audience trees house sum enterprises city bedrooms crowd terrace items pieces sizes inventory dumpster sets set database artwork yard systems chunks chunk TV photo firms team degree spaces bathroom building families home container
clear,9697,understanding,2381,understanding water picture vision waters idea table message view evidence skies path . indication instructions day way communication goals coat skin plan winner glass direction images focus sky sign case advantage information explanation example distinction expectations manner aligners sense statement signal sound set answer voice signs image rules strategy guidelines definition choice plastic finish space days guidance bag objectives language majority goal lines purpose solution line process leader structure need terms indicator mind liquid container window overview night difference explanations display cut conscience braces benefits point text reason head made pictures advantages answers boundaries instruction link views call field trend
sharp,2307,knife,855,knife edges contrast objects increase edge focus end drop rise corners decline teeth pain lines turn images eye blade cheddar wit fall cheese blades claws angles carousel point scissors increases skills knives eyes look image mind points criticism turns object curve relief rocks right declines pains stick decrease spike parts sense blows colors angle vision tools bend corner photos sword uptick ones peaks break things sound bends cut taste fangs changes display ball hook minds performance clear curves rock finish fluctuations instrument items stuff distinction design shot note reduction casings tip scraper lens screen cases microwave characters intellect scalpel dialogue
black,15302,pepper,3793,pepper hole wire people beans box man holes color finish red white tea market dress hair men screen background women community belt olives leather magic paint woman metal pants ink rug bag frame colors students lines powder jacket line spots boots top version one . hat image cat suit bear switch jeans light coffee table fruit interior tie cap smoke eyes design stripes film case base bears coat shirt door images paper cherry dial eye photos person colour teas plastic skirt shutters pen strap ideas cover trim rice tops shoes look population fabric ones material trousers marker mold set text
white,18518,black,3735,black paper red wine background rice table gold beaches flowers people light cells cabinets paint color chocolate shirt room sand beach vinegar space house trim nightstand wines papers flour bread dress man walls pink sugar men balance furniture noise desk colors pepper sands supremacy finish ideas board wire matter marble women powder door tile one frame beans lights cardstock wall colour sauce jeans coat . box fabric shade male spots hair bed roses blue stripe curtains border line meat person rafting design lines pants supremacists ink goods teeth base fish painting woman stock horse card diamonds stripes bedroom tiles cabinet
tight,2416,end,755,end budget spaces ends deadlines seal muscles schedule fit control space grip deadline back budgets container race spots lid security schedules spot market corners areas integration jeans game community knit turn turns range band timelines angle controls constraints tolerances corner group battle clothing frame pants rein hands containers places circle quarters area fitting ship position squeeze situation junctions radius rope coach curls conditions formation contest ball connections skin perfumes feeling leg leash hamstrings supply harmonies circles hips clothes network restrictions curves environment streets collars shoes hold ponytail games bends defence handling arms loop structure half timeline construction hug groups times
clean,6506,water,1878,water energy lines air look environment design sheet . cloth up slate rooms home room tile house clothes surface place record sweep finish towel skin sheets way interface easy install clean keep carpets condition ups surfaces space power system technologies face removal future tiles area service bowl cut style hands use source bill sound tank break hotel scent code fun solution facilities appearance dry products sources solutions towels feeling line food technology windows facility outs process chit rag interior experience title beaches jar need conditions sand copy floor car laundry state smell eating vocals dishes projects cuts project areas sets
sweet,6036,potatoes,1733,potatoes spot tooth potato treat treats sauce taste flavor girl friend boy wine corn fries scent tea smell aroma peppers fruit time oil home story shop baby short deal finish memories . flavour notes tones peas fruits fragrance things words flavors comment card note heart lady man voice dog dish stuff smile face flavours sound day basil dreams dishes bread memory idea thing something recipes dessert gift side onions moments almond music guy cards image snack family way foods love husband post milk wines friends recipe chips faces biscuits pie food vanilla message combination blend mix vermouth soup girls casserole
smooth,3952,transition,1290,transition surface finish experience ride operation skin texture process surfaces sailing flow paste running consistency pulley functioning hair soft lines muscle cells leather movement taste . transitions operations feel transaction vocals cream edges motion action look appearance batter performance one gameplay way fabric control top path ceiling start touch dough design transfer side layer implementation corners mixture blend clean feet edge beat manner line results style response cut stones curve jazz voice muscles video brakes integration face system butter power acceleration vodka tannins journey tone move rides installation delivery site website contours ball sauce fit sand feeling sale drive whisk
straight,3078,line,1052,line lines games year hair sets game face edge distance years win leg path points week answer title victory teeth day season hem wins shot seasons up days piece man month people road edges card losses way go legs loss time hours razor months victories cuts answers section structure fit starts cut student stitch walls draw bet cable championship framework weeks end forward session bets men defeats ahead sides process oil finishes away approach quarter course test flush back swap start bar stairs appearance run facts arms design truck communication league track match rows spine roads side championships paths finish
strength,392,training,301,training . gives have gone provide has minimizing gave build speed gain increase give body courage strength lies show is find size grow showing work had comfort using skills clarity restore rum keep shows density offers lot going solutions system weak provides used need Has demonstrated life catch gather play regain erections belies weathering valued felt signify deliver generated imparts respects builds circulation average impressed endurance scale exercises fortitude working journey succumb struggling replenish toy skin epitomizes shocked seemed skill praised month send maple person staff trials enable front qualities fighting projects adds force layers hook run configuring comment difficult
wide,16093,range,1935,range variety selection array receiver web spectrum area network assortment choice angle world audience receivers lens field base space spaces margin scope collection experience number feet spread . band use diversity coverage panels support leg straps long size areas opening gamut net distribution eyes road belt view appeal margins deep portfolio mm knowledge screen acceptance body format gap set application paths Size ranging angles variation circle shots ranges plank width scale breadth doors gate bands streets varieties adoption expanse smile beaches floors flooring open lenses medium shot cm options mouth stand berth high side sky community ' tall inch track
tough,3389,time,996,time times one questions decision job decisions competition game task day conditions question . call year situation guy situations spot part love work choice thing stains choices nut challenges battle challenge issues test match days week boats jobs defense act team fight environment sell games problems guys economy road place period environments terrain cushions opponent spots season measures case race way losses process tasks laws workout talk start matches life stuff cookie run climb subject loss assignment gig world skin material shell circumstances glass years experience stance finish nylon matchup issue cases exterior side lesson months going market coating restrictions
cool,5958,place,1906,place stuff water air things thing breeze ideas idea features weather way feature kids look people . game design nights day drink warm keep places room gadgets colors style breezes part designs guy spot piece experience climate prizes evenings games temperature pictures whip photos site cars video box tones waters name light project bath morning days story environment drinks area mornings temperatures home materials winter concept birthday shade tips system vibe music conditions tricks summer bag job location tools effects atmosphere grey gear glass decorations season gadget feeling effect table company pattern videos gray app products wind factor projects moment
red,11498,wine,2756,wine carpet light cells flag color flags tape meat onion pepper peppers black line card wines hair onions roses white fruit lights sauce berries flakes fruits colour sofa zone colors eyes lines paint microfiber button powder flowers brick ribbon shirt one beans door dot lipstick pink dress box . blue leather states gold shades chilli rice lip paper tones tea grapes stripes ink velvet cards herring lips shoes skin seal dots herrings oak planet clay cabbage green hat vinegar bricks background eye top LED deer cross tops apples potatoes ones coloring X cloth spots leaves pill rose cedar colours ball
deep,8505,breath,2330,breath understanding knowledge water dive sleep breaths learning end experience love roots cleaning sense massage pockets color sea connection expertise relaxation appreciation breathing level interest commitment waters cuts insight voice fryer discounts red analysis snow colour relationships space meaning insights respect hole state bass depression concern passion valleys impression thought dish blue wide desire pan freeze tub work pool trouble links feeling south wrinkles connections networks cut purple ocean fishing wounds research faith valley brown linking . treatment sadness conversations meditation background need exploration history tone relationship gratitude questions techniques affection run tissue hue thrombosis part impact house dives cleanse
warm,6177,water,1449,water weather air welcome place day days up atmosphere tones environment glow climate feeling bath waters hospitality light clothes keep colors milk months . temperatures sun feel fuzzies smile home spot bread cup room sunshine oil ups conditions night clothing temperature house colours color summers blanket reception wishes front soft climates nights summer tone bed embrace people area fronts fire breeze hug evenings evening setting shower season lighting time touch space community drink towel tortillas memories food cool afternoon temps loss finish period item personality stay meal manner blankets mixture lights feelings service person soup fireplace design look morning ambience
weak,1678,points,792,points point spot spots demand areas link economy system signal growth side data muscles ones systems hands stomach position people one performance dollar argument . activity market skills signals recommendation year man state government governance force area links perturbation correlation solution conditions hand field keys voice currency results report team condition leadership recovery institutions prices markets quarter foundations outlook muscle coffee pulse start person economies captcha foundation opponents responses light response nails topics power battery defense body sense moment orders feeling association tooth students layers pins spark ankles infrastructure place capacity hair method stock awareness coverage long variation processes confidence
hard,13528,work,2293,work drive time drives way disk times . copy part water look day rock money surfaces thing questions surface working cash things case copies task one disks floors space sell life line soft worker reset decision evidence place feelings worked rules hat job cover truth question data facts labor fork stuff shell decisions skills science matter eggs road problem plastic material hats floor cider screwdriver days liquor materials game people areas cheese problems training layer use edges places fact rule fan dollars choices currency man wood assets check cases sciences numbers ground find workers lesson woods choice parts labour courts
long,32125,time,3873,time term way run history period day list life periods hours journey hair distance weekend line range distances process short haul career sleeves trip days lines while walk story road tradition drive one years shot wait walks relationship ride tail times trips finish flight tables experience record table battle winter jump . runs sleeve stretch break night lasting game series legs months wide beach season stretches look ago journeys pants post exposure service week side ways stay positions rides queues string view piece ball duration length dress summer relationships association bath grass form strips version waves chain nights shirt enough
short,18332,term,2742,term time period walk stories story drive distance film video films notice list while amount break trip ride article answer hair form long span quotes supply years sale videos periods hairstyles stroll run space description life sleeves months courses version distances order sales cut circuit post course fiction lifespan weeks work length cuts duration piece stay book history clip essay breaks bursts times haircuts introduction trips side frame one hike presentation visit flight survey end game tour days section message range collection review journey ribs repeats articles series season clips summary note goals session make sentences . positions documentary way
dirty,1161,work,516,work dishes water laundry clothes hands filter job word money diapers carpet book tricks clean secret look secrets windows air floors diaper jokes bomb one grout streets filters tree martinis carpets house socks system looks rice pages oven piles game ducts joke clothing copy man sensor rugs get business conditions war dozen electricity items grandpa martini talk environment data rag floor fuel gutters snow more pots surfaces car bathroom beam become getting surroundings buffers parts plates energy areas spots player surface building way city dealings coal blonde coils linen politics books truth image tables fingers glasses needles sign picture cop
soft,7285,cushions,2069,cushions drinks skills spot tissue fabric cloth tissues material feel drink hard brush texture leather headboard skin furnishings cotton light top . color finish bed touch peaks surface dough cover foam toys glow injuries materials lining colors cheese corals lighting landing blanket music seat tannins viagra case sand water tones voice power toothbrush launch toy area ground side look hands mattress grass tabs reset fruit copy hand spots bag waves wood design feeling market cushion palate towel keys blend bristles cream hair suede snow headboards pillows yarn flesh effect towels sponge start smooth layer shoes covers shell bread interior surfaces
