text1,text2,label
It 's very [hard] to contact Wood - mode / Brookhaven because I ca n't find a phone number and the only way to contact them is by filling out a form online and hoping they call me .,"hard: Firm, solid, resistant to pressure, tangible",0
"- stop dancing for the hour - long class , your [cool] kids will learn a little about the history of the five main street dance styles .",cool: of or at a relatively low temperature,0
"In a comparison of whites and African Americans , 55 percent of the white parents and 70 percent of the [black] parents said they coslept with their babies .","black: evil, bad, unsavory",0
The borough said the building ’s estimated market value of € 5.2 million ( $ 6.12 million ) would make it [hard] to earn enough money to justify the outlay without raising the rent by instigating a luxury conversion .,"hard: Firm, solid, resistant to pressure, tangible",0
"While 75 % of our guests are completely happy to enjoy an unstructured windjammer vacation , we do offer some pretty [cool] specialty cruises .",cool: of or at a relatively low temperature,0
"When it comes to shoes , this getup is complemented perfectly with [black] espadrilles .","black: evil, bad, unsavory",0
Very [cool] giveaway .,cool: of or at a relatively low temperature,0
A fuzzy [black] squirrel is sitting here scavenging for some food .,"black: evil, bad, unsavory",0
The [cool] down end part of a class will recondition and pacify the nervous and cardiovascular systems .,cool: of or at a relatively low temperature,1
""" What word? .. I need a [cool] word to stamp ! ! !",cool: of or at a relatively low temperature,0
The Funny Dictionary : An A - Z of Kids ’ Funny Definitions includes around 40 [black] and white photographs from the National Library ’s pictorial collections .,"black: evil, bad, unsavory",0
Keep in a [cool] dry place .,cool: of or at a relatively low temperature,1
This is a spot for the [cool] crowd who likes the idea of BBQ but if you are a fan of Henry ’s or Bucky ’s you might feel cheated by the portion sizes here .,cool: of or at a relatively low temperature,0
The bezel rim is [black] nickel as it says in description .,"black: evil, bad, unsavory",0
"In my case , I have an excellent large gentle source , however I am photographing a black suede pump and generally [black] products want an additional fill to see texture and element ( because it ’s darker ) .","black: evil, bad, unsavory",0
"Today 's recipe is a refreshingly [cool] drink to beat the heat , Watermleon Lemonade .",cool: of or at a relatively low temperature,1
"Results 122 of 22 ... 15 litre container28 results from brands simplehuman , honey - can - do , milton , .... water [cool] for many hours made of food grade material racer insulated water coolers .... need price including air shipment to canada .",cool: of or at a relatively low temperature,1
Our demineralization cartridges help to reduce buildup in your humidifier tank caused by [hard] water .,"hard: Firm, solid, resistant to pressure, tangible",1
"Moreover , if you are not satisfied with all the [hard] work you have put in , you can easily detach the chair from the boat by unscrewing the pedestal .","hard: Firm, solid, resistant to pressure, tangible",0
"Stay [cool] , comfortable and completely shielded from the sun all summer long in men ’s straw Panama hats from Hats in the Belfry .",cool: of or at a relatively low temperature,1
"This is because you would not like to have any [hard] feelings , as it may affect your future job .","hard: Firm, solid, resistant to pressure, tangible",0
"Secluded , but easy access , romantic po , er and clean and elgends family vacation lake and mountain view log cabin for rent on [cool] high elevation Lake Legends casino poker .",cool: of or at a relatively low temperature,1
The screen turns [black] on random occasions where sometimes nothings is visible and sometimes you might be able to see the cursor but the background wallpaper is completely black .,"black: evil, bad, unsavory",0
Does the external [hard] drive have the same option to retrieve deleted files as a regular computer hard drive ?,"hard: Firm, solid, resistant to pressure, tangible",1
Its silky rayon material delivers a silky luxurious fit and icy [cool] feel even on those hot summer days .,cool: of or at a relatively low temperature,1
Choosing whether the winning number is going to be red or [black] is the perfect example of an even bet .,"black: evil, bad, unsavory",0
"When he came to the battle , the Pawnees were having a [hard] time , because the enemy were so many .","hard: Firm, solid, resistant to pressure, tangible",0
This was a special order of [black] discs .,"black: evil, bad, unsavory",0
"Retro is back in style , flaunt the same as you adorn this T - shirt in [black] coloured from the house of American Crew .","black: evil, bad, unsavory",0
"The steepest parts of the climb were in a [cool] damp fog that lifted , or rather , that I rose above just before the Montebello parking lot .",cool: of or at a relatively low temperature,1
It was an honor to wear the [black] and gold and be apart of the rich tradition of the Pirates Organization .,"black: evil, bad, unsavory",0
"Two of my favorite rooms in the home are also down here , including the media room ( with a [cool] framed flat - screen television ) and an exercise room , which I 'd love to have in my own home .",cool: of or at a relatively low temperature,0
There is a definite electronica texture and this is quite a [cool] piece of music – and one that stands out nicely from the rest .,cool: of or at a relatively low temperature,0
One other great thing is that this game is actually challenging unlike most RPG 's out there today ... it 's not so [hard] that you 'll want to quit but its not too easy either .,"hard: Firm, solid, resistant to pressure, tangible",0
"65 Double Upper High Top Chucks Outside view of a left [black] , red , and white double upper high top , with the outer upper rolled down .","black: evil, bad, unsavory",0
"But from the air the nearly 2 million - acre preserve appears like a mosaic of wet meadows , oxbow lakes and [black] spruce muskegs broken up by dense stands of white spruce as well as paper birch , balsam poplar , alders and willows .","black: evil, bad, unsavory",0
"Designed in collaboration with Whipsaw , Cinema One deliberately rejects the austere [black] box aesthetic .","black: evil, bad, unsavory",0
"The strollers have an aluminum alloy grey or black frame with a black fabric toddler seat , a colored fabric sunshade canopy , and a [black] basket under the seat .","black: evil, bad, unsavory",0
"As Lee writes , having students do reports on [black] scientists can also be a way to help them learn about contemporary scientists who , despite not achieving widespread fame , have made significant contributions .","black: evil, bad, unsavory",0
He was trying too [hard] to make me believe what he was saying .,"hard: Firm, solid, resistant to pressure, tangible",0
I think it 's [cool] .,cool: of or at a relatively low temperature,0
It 's [hard] to provide a good review and notice something is missed on an engineering report if you have no background in engineering .,"hard: Firm, solid, resistant to pressure, tangible",0
"Now that the elation over electing a [black] man president seems to be subsiding , I hope people can look at this thing realistically .","black: evil, bad, unsavory",0
"I have mentioned my [black] eyebrows , and I got Bow Brow in black .","black: evil, bad, unsavory",0
"Do not make any payment using Western Union or Moneygram – they are extremely [hard] to trace , so scammers love it .","hard: Firm, solid, resistant to pressure, tangible",0
We sat on a bluff looking out to the ocean and in the distance we could see little [black] dots that were seals in the water .,"black: evil, bad, unsavory",0
"It smelled [cool] and earthy , like fresh mushrooms .",cool: of or at a relatively low temperature,1
"Some coral debris , molluscs , and foraminiferal sand are stained [black] , because of precipitation of free pyrite in a reducing environment caused by weak currents and quiescent conditions , in the presence of plant and organic debris , mainly algae and sea - grass .","black: evil, bad, unsavory",0
"So before the [cool] weather arrives , make a batch of these Lemon Raspberry Buttermilk Popsicles and celebrate the remaining days of summer in style !",cool: of or at a relatively low temperature,1
"Everyone this morning pushed it [hard] to give the mission their best shot , even though they had to report the dead animals over the radio .","hard: Firm, solid, resistant to pressure, tangible",0
Unfortunately also the franchise industry is not immune to [black] sheep ” .,"black: evil, bad, unsavory",0
And especially in those hot temperature days you will be wanting something [cool] and refreshing to drink .,cool: of or at a relatively low temperature,1
"Researchers captured the extreme frame dragging by analyzing X - rays emanating from a disk of star debris swirling around a [black] hole about 28,000 light - years away in the Milky Way .","black: evil, bad, unsavory",0
"Rose , Troy ’s wife , illustrates [black] optimism or disillusionment .","black: evil, bad, unsavory",1
"Especially when you ’re dealing with many students , it ’s [hard] for the teacher .","hard: Firm, solid, resistant to pressure, tangible",0
"This 2011 Aston Martin DBS Carbon Black Edition presented in Carbon Black with [black] leather interior and black piano wood has a large specification including sat nav , 2 + 2 seats , custom tread plates , unique sill plaques and auto dimming rear view mirror .","black: evil, bad, unsavory",0
"The collarless design keeps you [cool] and comfortable during the warm season , whilst the minimalist single - button fastening and dual rear vents retain a key silhouette for a smart yet comfortable fit .",cool: of or at a relatively low temperature,1
"The EDX spectrum of the black color layer only shows the emission peak related to the Carbon , which seems to indicate the presence of a carbon [black] pigment used for the decoration .","black: evil, bad, unsavory",0
I feel like the pregnancy became my identity and I ’m having a [hard] time letting that go .,"hard: Firm, solid, resistant to pressure, tangible",0
"The updated kitchen feels fresh with white cabinets and walls , [cool] gray granite counters , stainless steel appliances , statement light fixtures and an eat - at island .",cool: of or at a relatively low temperature,1
They think it ’s really [cool] to have an American on the team .,cool: of or at a relatively low temperature,0
"Bruce Lee once said that I pray not for an easy life , but the ability to endure a [hard] one !","hard: Firm, solid, resistant to pressure, tangible",0
"We do n’t blame you , it ’s a pretty [cool] name .",cool: of or at a relatively low temperature,0
I have just been through this as the Field Marshall bought an old [black] bakerlight phone for the front room and I had to get it to match our wiring .,"black: evil, bad, unsavory",0
"Blueish black you find for instance at certain types of corn , some potatoes are purplish [black] and a lot of mushrooms are brownish black .","black: evil, bad, unsavory",0
"A proud man who feels trapped in his [black] skin , Jack wants a family but can not help always looking for "" the good life "" for himself .","black: evil, bad, unsavory",0
"Yes , this Seagate ST3160813AS [hard] drive can qualify for the $ 60 hard drive Repair Service .","hard: Firm, solid, resistant to pressure, tangible",1
These same public relations firms often discourage their [black] clients from working with black - owned media companies and advertising with the Black Press .,"black: evil, bad, unsavory",0
It ’s [hard] to have that discussion without sounding like a science degree snob though .,"hard: Firm, solid, resistant to pressure, tangible",0
"If your [hard] drive is making abnormal clicking noises but still works , back up your data immediately and replace the hard drive .","hard: Firm, solid, resistant to pressure, tangible",1
It is designed gracefully to give you a [cool] chic look that you can carry comfortably .,cool: of or at a relatively low temperature,0
"The entire challenge will be shot : A ) with a single camera ; B ) with the lenses I currently own ( 28/1.9 , 40/1.4 , 50/1.5 ) ; C ) on [black] and white film ( Kodak 400TX / Arista Premium 400 , Fuji Acros 100 and Neopan 400 , and other films ; I want to experiment with some different emulsions that I have not had the chance to try yet ) ; and D ) will last one calendar year ( 2014 ) .","black: evil, bad, unsavory",0
"If secure gaming is the one thing you are most worried about , Ruby Fortune Casino will never disappoint you , keeping it [cool] and safe at any point .",cool: of or at a relatively low temperature,0
"A soft new carpet makes all the difference in the home , especially on those [cool] mornings .",cool: of or at a relatively low temperature,1
"( Facebook did not release [hard] numbers of “ likes ” for each team , only the counties in which they held a plurality . )","hard: Firm, solid, resistant to pressure, tangible",1
"This kind of actions create non - realistic view of website ’s popularity on the internet , that ’s why most of the times [black] - hat websites get Google penalties .","black: evil, bad, unsavory",1
They are all looking for a awesome online partner to share some giggles in a [cool] chat conversation .,cool: of or at a relatively low temperature,0
The [cool] pattern of dovetails is what makes them so valuable .,cool: of or at a relatively low temperature,0
The street children have known no other life except the street ; they do not go to school and they grow up the [hard] way on the streets .,"hard: Firm, solid, resistant to pressure, tangible",0
You 're already paying a lot of money just to go on this trip and buying a lens dedicated to one vacation is a little crazy ( but [cool] as hell ! ) .,cool: of or at a relatively low temperature,0
"With the allure of [cool] days and pumpkin - everything , there ’s only so much more I can take of ice water and chopped salads for dinner .",cool: of or at a relatively low temperature,1
"Unhelpful thoughts usually come in the form of “ what if , ” “ [black] and white thinking , ” or “ imagining the worst case scenario . ”","black: evil, bad, unsavory",0
Our plan is to save everyone in Branchville from the scorching heat with a comfortably [cool] home .,cool: of or at a relatively low temperature,1
"In critical mass I ’m not sure that people understand black film as a [black] cinema — they understand one - off efforts , I think , but the larger context seems to be lost .","black: evil, bad, unsavory",0
I have a [hard] time getting up and going .,"hard: Firm, solid, resistant to pressure, tangible",0
After all our [hard] work ... it is done .,"hard: Firm, solid, resistant to pressure, tangible",0
"I had to gain some weight for the role , so the hardest part was trying to look [cool] while running and not look totally exhausted .",cool: of or at a relatively low temperature,0
"Engine stalled a few times , [hard] to start etc .","hard: Firm, solid, resistant to pressure, tangible",0
"As you will certainly recognize , it is simple to spill a number of different materials on your carpet and there is likewise the deep - rooted dust and dust that could be [hard] to get out .","hard: Firm, solid, resistant to pressure, tangible",0
A wonderful combination of [black] and chrome plating .,"black: evil, bad, unsavory",0
"Place the [black] probe on ground ( or "" minus "" ) terminal of the battery .","black: evil, bad, unsavory",0
"I felt that the hat needed some [black] near the top to balance all the black at the bottom , so I made the top into a spiderweb as I decreased .","black: evil, bad, unsavory",0
"It 's [hard] to describe it ; imagine a very fast - paced waterfall ending in shallow waters , but also distorted ( maybe it 's better to say "" compressed "" ) , and at a really high volume - like , when it was at full volume I literally had to turn down the PC sound a bit , but just seconds before I could barely hear the sentences whispered by my Reaver .","hard: Firm, solid, resistant to pressure, tangible",0
"While many use the term to describe a flight recorder , a [black] box is an intelligent and complex device that records information that the user can not .","black: evil, bad, unsavory",0
"I 'm so sick of showing you my [black] satchel that I 've been using lately , so much so that I did n't include it in any of these pictures !","black: evil, bad, unsavory",0
"He helped bring things back to the essence of proper , pure trance music without the harder more aggressive EDM , dubstep and house influences that were prevalent in ' trance ' music at the time and made it [cool] to be un - cool again .",cool: of or at a relatively low temperature,0
Late last year I reached out on social media to find out if anyone had a [cool] 911 I could photograph and very soon after Tom at Paul Stephens 911 in Essex reached out and said ' Yes ' .,cool: of or at a relatively low temperature,0
Standard [black] laminate finish .,"black: evil, bad, unsavory",0
Hard Drive & Disk Drive : Avoid using the [hard] drive and disk drive excessively .,"hard: Firm, solid, resistant to pressure, tangible",1
Salty Mexican rice and [black] beans played perfectly with sweet plantains .,"black: evil, bad, unsavory",0
"I always thought it would be [cool] to combine translation memory , machine translation , and artificial intelligence .",cool: of or at a relatively low temperature,0
"It was 1959 , and the white kids danced with white kids and the black kids danced with [black] kids , but for some members of the community , that was too much integration .","black: evil, bad, unsavory",0
All Amulets come with [black] satin cord and information card .,"black: evil, bad, unsavory",0
The Hopi Indians used the purplish [black] seed hulls to create red and indigo dyes that were used in dyeing ..,"black: evil, bad, unsavory",0
She has been our friendly “ front of house ” for 10 years and will be a very [hard] act to follow !,"hard: Firm, solid, resistant to pressure, tangible",0
"Once I was happy with the template , I cut it out using the edges of the [black] marker as a guide .","black: evil, bad, unsavory",0
But I think BlogLovin ' is where all the [cool] kids are going .,cool: of or at a relatively low temperature,0
Our [hard] drive recovery service is such that our knowledge of all things hard drive plus the technology at our disposal means that we are perfectly placed to help our customers – both business and domestic- retrieve their data before it is lost forever .,"hard: Firm, solid, resistant to pressure, tangible",1
Fortnite VBucks Cheats 2018 has latest built in features and as a bonus we added some [cool] tricks that will be described in notes.txt file after installation .,cool: of or at a relatively low temperature,0
The mature oaks provide ample shade allowing everyone to stay [cool] in 90 degree+ heat .,cool: of or at a relatively low temperature,1
"It ’s been a long , [hard] road .","hard: Firm, solid, resistant to pressure, tangible",0
Throw these across your hands for a [cool] look !,cool: of or at a relatively low temperature,0
With many families having two working parents it 's [hard] to know what to do with the kids .,"hard: Firm, solid, resistant to pressure, tangible",0
"Lucy , is a beautiful very dark [black] with white on her chest and paws .","black: evil, bad, unsavory",0
"From the very first page , I was drawn into the story of this house said to have a [black] soul and the tale of three former Nuns , empaths , employed by the Church to determine if there is any evidence of possession .","black: evil, bad, unsavory",1
Pretty [cool] version .,cool: of or at a relatively low temperature,0
"Brown patch on [cool] season grasses requires thes items : Water , heat , warm nights , humidity .",cool: of or at a relatively low temperature,1
"This week we chat with @Penny_Elmslie , Head of Marketing for the [cool] accounting software Xero .",cool: of or at a relatively low temperature,0
It 's [hard] to know what to say about that .,"hard: Firm, solid, resistant to pressure, tangible",0
Knowing that I took the run not too [hard] .,"hard: Firm, solid, resistant to pressure, tangible",0
Your kids spend a lot of time at school doing [cool] things .,cool: of or at a relatively low temperature,0
"It is hand carved circular disk , made from a green hard stone , carved applied [hard] stones , carnelian , amethyst , agate , and a glass gold stones .","hard: Firm, solid, resistant to pressure, tangible",1
It would be [hard] to find a town on Queensland ’s Sunshine Coast that is more charming than Montville .,"hard: Firm, solid, resistant to pressure, tangible",0
"These are angles in degrees , 0 is horizontal , 90 is straight up , so you can see the red ( R ) arm is up , and the [black] ( B ) is horizontal .","black: evil, bad, unsavory",0
One [cool] thing we learned while talking to our waitress is that the owners of the restaurant grow a lot of their own vegetables on their own property .,cool: of or at a relatively low temperature,0
"This post of "" 40 elegant [cool] bedroom paint ideas "" was published on 08 - 08 - 2018 by jonshon .",cool: of or at a relatively low temperature,0
Is it [hard] to watch at times ?,"hard: Firm, solid, resistant to pressure, tangible",0
He was just kinda a [cool] kid I ’d seen around the metal shows .,cool: of or at a relatively low temperature,0
""" It 's [hard] to calculate , it 's harder to implement in the experiment . ""","hard: Firm, solid, resistant to pressure, tangible",0
"The entry - level , 800MHz model is the least attractive of the bunch , given that you can get a similarly configured iMac , with a screen , a larger [hard] drive , and a SuperDrive , for $ 200 more .","hard: Firm, solid, resistant to pressure, tangible",1
"In the same way , it is similar in the case of formatting the drive as space is not overwritten , it is more possibility that you can recover data from Western Digital external [hard] drive .","hard: Firm, solid, resistant to pressure, tangible",1
"Anyway , even though not truly permanent , this would be really [cool] technology if it were possible !",cool: of or at a relatively low temperature,0
"Designed to get wet , our USP 50 + Quick - Dry bucket hat in Bright Pink will keep your baby or toddler [cool] and safe from the sun .",cool: of or at a relatively low temperature,1
This can offer a powerful and [cool] try to find the new Azera .,cool: of or at a relatively low temperature,0
"After that we walked around downtown , went in some [cool] shops .",cool: of or at a relatively low temperature,0
Advanced thermal printing technology enables photo - quality [black] & white prints with resolutions up to approximately 325 dpi and grey levels up to 256 steps .,"black: evil, bad, unsavory",0
"Poverty The US census reported that While interracial dating continues to be on the rise in the United States , [black] people remain the minority group that has relationships outside of their race the least at 19 percent .","black: evil, bad, unsavory",0
It ’s a pretty [cool] place .,cool: of or at a relatively low temperature,0
"The Deluxe kit comes with air conditioning to keep you [cool] , no matter how hot it gets outside .",cool: of or at a relatively low temperature,1
I wept as I tried to make sense of moments and words my heart was having a [hard] time translating .,"hard: Firm, solid, resistant to pressure, tangible",0
"Jonathan ’s eco - chic kitchen featured a natural bark wall , an oversized island , high ceilings , and unusual [black] cabinets with contemporary Top Knobs fixtures .","black: evil, bad, unsavory",0
"This is a moisturizing gel to be used when paw pads have become dry and rough or during periods when the surface tissue in paw pads tends to become [hard] , such as the dry winter season .","hard: Firm, solid, resistant to pressure, tangible",1
“ I 'm hugely grateful to Jack for his [hard] work and loyalty .,"hard: Firm, solid, resistant to pressure, tangible",0
"They were stored in my home for most of the time , in a card board box in a [cool] temperature room .",cool: of or at a relatively low temperature,1
"This look , to me , feels like we ’re talking to a [cool] technology company that ’s about to launch an amazing new product .",cool: of or at a relatively low temperature,0
"My emphasis in photo has always been fine art [black] and white , concentrating on symmetry , and balance of a subject as well as light and shadow .","black: evil, bad, unsavory",0
It still uses the same [black] cover that they called as Obsidian Black .,"black: evil, bad, unsavory",0
screwdriver for [hard] to reach places ergo slim screwdrivers .,"hard: Firm, solid, resistant to pressure, tangible",0
"If you ’ve always wanted to own one , but either ca n’t find it online or ca n’t afford what collectors are asking , an unbranded Graffiti Cocktail Shaker can be found online for a [cool] $ 20 .",cool: of or at a relatively low temperature,1
"The heritage of white supremacy , or its ongoing structures to whatever degree they exist , could at most explain why the [black] family began its collapse before the white family , which also explains why black families are less likely to be strong today than white families or Hispanic families .","black: evil, bad, unsavory",0
"So to recap , the reason for my recent use of a cap and brolly is not because I ’m trying to get everyone to follow British stereotypes , but because I ’m trying to disguise my face from a few sodding [black] birds … but not blackbirds , and to be honest I do n’t think it ’s sodding working .","black: evil, bad, unsavory",0
