text1,text2,label
One [cool] feature of docstrings is that Python can use them to automatically generate documentation .,cool: of or at a relatively low temperature,0
"Sometimes when it wakes from sleep , I lose my background ( just a teal colour ) and it goes to a [black] background ( which I can revert back to teal right away in my desktop options ) .","black: evil, bad, unsavory",0
Igloo is one of the world ’s leading cool box manufactures meaning you can keep your food [cool] on ice in confidence .,cool: of or at a relatively low temperature,1
"# 62 , I agree , I do n’t really know w/ Lehr ( but based on his stats , I do agree ) particularly , but the whole concept that it ’s [hard] to find starting pitchers , especially # 5 quality pitchers is getting annoying fast .","hard: Firm, solid, resistant to pressure, tangible",0
"If you 're like me with a more adventurous gardening style , I 'd recommend making a miniature forest with a row of [black] spruce tips .","black: evil, bad, unsavory",0
"In the next page , we have the awesome home theatre modern with 6 [black] leather home theatre seating in a row surrounded by geometric soundproof wall decor [ ... ] .","black: evil, bad, unsavory",0
"I know , I know – you may have heard the same thing before from those that think it ’s [cool] to hate Microsoft ; but I ’m not one of those guys .",cool: of or at a relatively low temperature,0
"As a sanity check , I asked my husband who has been married to me for 28 years - "" Would you say marriage is [hard] work ? ""","hard: Firm, solid, resistant to pressure, tangible",0
"After all , it ’s generally well - liked that [black] cars are hotter in the sun and white cars save cooler in the summer , but is it essentially true ?","black: evil, bad, unsavory",0
I have heard of stories wear necklaces would turn [black] because it 's not real Silver .,"black: evil, bad, unsavory",0
"A chrome Lokar shifter rises to within easy reach of the driver and wears a matching leather boot , and the Chevy - branded billet steering wheel also ties into the color scheme with its leather wrapping and sits in front of a stellar dash area that features an assortment of white - faced TPI - Tech gauges , as well as quartet of in - dash vents to bring [cool] air into the cabin via a climate control system that 's functioning at its best .",cool: of or at a relatively low temperature,1
The original fragrance symbolizes timeless elegance and classicism ; Legend Intense from 2013 is its night version ; and the new edition is announced as the ultimate timeless and [cool] scent .,cool: of or at a relatively low temperature,0
"It 's a [hard] decision to make but my favorite character Suigintou , also known as Gin - Sama .","hard: Firm, solid, resistant to pressure, tangible",0
"Without strong headings as organization , it is [hard] to find what kind of work you have done on which projects .","hard: Firm, solid, resistant to pressure, tangible",0
The concept is really [cool] - a friend of ours got into the booth and inspiration led him to answering a few questions we asked him .,cool: of or at a relatively low temperature,0
"These were the really [cool] "" fire balloons "" that everyone was letting off .",cool: of or at a relatively low temperature,0
"The stinger hood is a great addition to this small - block car , because the cool white streak is a [cool] match for the white folding roof making this Sting Ray striking with the top up or down .",cool: of or at a relatively low temperature,0
"For the Red version : small Bibi made of felt in red / pink colour , accompanied by small white PomPoms to garnish the heart , all mounted on a base , also in felt , [black] color .","black: evil, bad, unsavory",0
This is [hard] from some people .,"hard: Firm, solid, resistant to pressure, tangible",0
"That sounds [hard] to believe for a player who permanently had a smile on his face and appeared to ooze confidence , yet the Trinidad and Tobago legend regularly utilised the technique throughout his four seasons as a Red , in which he scored 66 goals in 152 appearances , winning six major trophies .","hard: Firm, solid, resistant to pressure, tangible",0
Reliability : One of the key factors about the operation of an external [hard] drive is its reliability .,"hard: Firm, solid, resistant to pressure, tangible",1
I think this discovery is really [cool] because rome - era tombs are from way back when .,cool: of or at a relatively low temperature,0
"To an Orthodox Jew , Ron Wyatt ’s claim that the Ark was put under Calvary - site of the crucifixion of the Nazarene - is one that seems [hard] to swallow .","hard: Firm, solid, resistant to pressure, tangible",0
"Your declaration may leave an indelible mark on your credit history that is [hard] to entirely escape , but remember , you are not the only one .","hard: Firm, solid, resistant to pressure, tangible",0
How [cool] is that ?,cool: of or at a relatively low temperature,0
You will be amazed at the difference in the taste of canned black beans compared to dry [black] beans made in a slow cooker .,"black: evil, bad, unsavory",0
"Only [hard] copies : Stradivari ’s Genius by Toby Farber ( which I ’m reading again for the third time ) and The Silmarillion by J.R.R.Tolkien ( which is hauntingly beautiful and despite having read it several times , I can never put it down ) .","hard: Firm, solid, resistant to pressure, tangible",1
"During this dynamic period , Li ’s model shows , [black] holes suddenly became a lot more star - friendly .","black: evil, bad, unsavory",0
"To wire the lover , it 's just a make any difference of connecting the [black] wire on the ceiling fan for the black wire in the switch .","black: evil, bad, unsavory",0
"White founders are older than their [black] counterparts – 48 % are over the age of 35 , compared to 36 % of black founders .","black: evil, bad, unsavory",0
"Taking on a bad project — or a [hard] client — costs more in the long run , as you ’ll constantly have to hound the client for payment , prove your worth , and argue against incessant design changes .","hard: Firm, solid, resistant to pressure, tangible",0
I got a BS in Economics and Political Science from TAMU and a [cool] watch from my dad ( on the right . ),cool: of or at a relatively low temperature,0
"Evidence showed that : ( 1 ) the franchisee admitted , while a prospective franchisee , to receiving a "" [black] book "" from the franchisor ; ( 2 ) the franchisor ’s May 28 , 2002 UFOC was bound as a black book ; ( 3 ) the franchisee signed a written acknowledgment of having received the May 28 , 2002 , UFOC ; and ( 4 ) most importantly , the franchisee produced the first two pages of the May 28 , 2002 UFOC in the course of the litigation .","black: evil, bad, unsavory",0
I tried to act [cool] like I was expecting that .,cool: of or at a relatively low temperature,0
By [black] magic you can do anything which you want to in your life .,"black: evil, bad, unsavory",1
In [hard] to reach places like the bottom and around the brick arch use the back of a spoon to smooth .,"hard: Firm, solid, resistant to pressure, tangible",0
"Confrontations and sit - downs had their tragic culmination in 1969 , when the student Jan Palach , 22 years old , immolated himself with petrol at the foot of the statue of Wenceslas in protest at the [hard] repression .","hard: Firm, solid, resistant to pressure, tangible",0
It was [hard] ,"hard: Firm, solid, resistant to pressure, tangible",0
"It could be "" just millions of years between stars and [black] holes , "" says Burns , "" could be a fair bit shorter than that . ""","black: evil, bad, unsavory",0
"This allows you to put one black UV [black] light on each wall of the room , ensuring a bright glow from all directions with no dark spots .","black: evil, bad, unsavory",0
"He has a lovely pinkish nose , ears , feet and tail and little [black] eyes to finish .","black: evil, bad, unsavory",0
"A Russian C2010 - 658 Real Exam prince condescended to sit in a corner for an hour and talk with a massive lady , dressed like Hamlet Certification Answers mother in [black] velvet with a pearl bridle under her chin .","black: evil, bad, unsavory",0
"Not to mention , I ’m so actually impressed concerning the [cool] tips and hints you serve .",cool: of or at a relatively low temperature,0
"I had a Blue - steel colored screen , with a chrome bezel and a [black] back plate .","black: evil, bad, unsavory",0
"That was just the [cool] part , the really cool part ?",cool: of or at a relatively low temperature,0
It was [cool] to see coverage of Johnny Cupcakes in a whole ‘ notha language .,cool: of or at a relatively low temperature,0
person will get crazy and approach ua as [black] magic is done on him / her .,"black: evil, bad, unsavory",1
"A smaller business may simply back up files to a CD or external [hard] disk , or a larger one may back them up to a redundant storage server .","hard: Firm, solid, resistant to pressure, tangible",1
Firstly laburnum trees are [hard] to find in Kerala now - a - days .,"hard: Firm, solid, resistant to pressure, tangible",0
Looking for a dumpster to rent should n't be so [hard] as there are several companies offering the services .,"hard: Firm, solid, resistant to pressure, tangible",0
"There were two pigtails removed from the box , and when I pigtailed the black cable3 wire to the SW2 and SW3 , and then ran the [black] cable4 to SW2 and black cable5 to SW3 , the chandelier light and outside light both work .","black: evil, bad, unsavory",0
"On those days , or the hot summer days where you 're only having a light meal with a [cool] glass of wine , an antipasti platter is always a great option .",cool: of or at a relatively low temperature,1
What ’s so scary about kids with [black] eyes ?,"black: evil, bad, unsavory",0
Lorn are an Italian [black] metal band and this is their latest EP .,"black: evil, bad, unsavory",1
The constant news about Trump and white supremacy is keeping emotions high in the [black] community .,"black: evil, bad, unsavory",0
"Strachan ’s [black] and white digital self - portrait depicts her in profile from the waist up , with her gaze lifted and her hands covering her bare breasts .","black: evil, bad, unsavory",0
"Soils in which the carbonate is evident only as a slight to moderate effervescence ( 1 M HCl ) , and/or contain less than 2 % soft finely divided carbonate , and have less than 20 % [hard] carbonate nodules or concretions .","hard: Firm, solid, resistant to pressure, tangible",1
"Aside from Jean - Paul Hévin ’s chocolates , or ‘ [black] pearls ’ as he calls them ( as each piece is created from the highest - quality ingredients ) , the ‘ Boutique et Bar à Chocolat ’ has now launched a two - course set lunch .","black: evil, bad, unsavory",0
"Following in the tyre ruts of its larger sibling , the Cherokee Night Eagle , which was launched in the UK last November , Jeep has announced a new Renegade ‘ Night Eagle ’ limited edition which is similarly based on the mid - spec Renegade Longitude , but adds 17 - inch black alloy wheels , rear parking sensors , satin grey Jeep badges and unique Night Eagle badging , coloured roof bars and side mirrors , and satin grey grille rings on a [black] front grille .","black: evil, bad, unsavory",0
"The fabric features an exceptional softness both in its hand and silhouette , lending a relaxed feel to the ensemble while a contrasting [black] interior , showcased on the lapels , is perfectly complemented by the maxi - stripe angora scarf underneath .","black: evil, bad, unsavory",0
When I saw the picture itself I could understand why my client had had such a [hard] time viewing and photographing it herself .,"hard: Firm, solid, resistant to pressure, tangible",0
""" soo it looks pretty [cool] but , it slows down my whole kindle . """,cool: of or at a relatively low temperature,0
"Kirin Ichiban ’s machine turns beer into a slushie that you can then use to top off a glass of beer , helping it stay [cool] for up to 30 minutes longer .",cool: of or at a relatively low temperature,1
Blacklane is another provider in the area offering BOI airport transfers which has a [black] car business class ride for those wanting a more luxury type of ride .,"black: evil, bad, unsavory",0
"After the fabric paint dries , you may use a black fabric paint to write [cool] things on the shirt such as ‘ ’ my kids walk all over me ’’ .",cool: of or at a relatively low temperature,0
Get your brand easily noticed in these Cross ® promotional ATX Basalt [black] pen sets !,"black: evil, bad, unsavory",0
This leather jacket will be perfect for formal evenings in [cool] weather- 40 degrees or so .,cool: of or at a relatively low temperature,1
"Many of them are very [cool] additions for your phone , but there ’s also a fair share of low quality ones .",cool: of or at a relatively low temperature,0
"It beats using 25 - year - old [hard] drives , that ’s for sure .","hard: Firm, solid, resistant to pressure, tangible",1
"A human being capable to talk things to the face of the main responsables of this , and not to look somewhere else to evil Porsches … the ambition of the world economies are so big that they do n’t care about the people ( Elysium ) … and then we are supposed to put on green glasses to pretend the solution is to be Vegan , do Yoga and look cool … there are no Gandhis any more that speak the truth for the good of all mankind not to look [cool] but to be true to your self !",cool: of or at a relatively low temperature,0
"The use of multimedia , including texts , blogposts , and emails was really [cool] and added understanding and depth , particularly as Claire tries to learn more about her family and how her mother viewed events that occurred in the past .",cool: of or at a relatively low temperature,0
It is important to ensure that the hat you are selecting has perfect ventilations to provide your head with [cool] air .,cool: of or at a relatively low temperature,1
"Find North face resolve jacket [black] black , Blue Men 's Outerwear in Shopzilla 's Clothing & Accessories category :","black: evil, bad, unsavory",0
"Here ’s a [cool] shorty from Mexico , focused on the boats that take fly fishers to the flats .",cool: of or at a relatively low temperature,0
There ’s even a really [cool] Superman costume hoodie that ’s super - stylish .,cool: of or at a relatively low temperature,0
Too many times in my OD we miss out on games that our users say are Epic or would just be [cool] to see .,cool: of or at a relatively low temperature,0
"A great start , but when another England chance to score went begging , still in the opening 10 minutes , in the face of [hard] New Zealand defence in the ' red zone ' , it set the alarm bells clanging ..","hard: Firm, solid, resistant to pressure, tangible",0
"Store it in a dry , [cool] space , preferably in a board bag like the Inflatable SUP Roller Backpack that comes with your SUP package .",cool: of or at a relatively low temperature,1
Prisoners shuck [black] pearls from cave - oysters and slowly forget how to walk upright .,"black: evil, bad, unsavory",0
Hatco heated [black] glass shelves are made of approved foodsafe materials allowing you to place food product directly on the glass surface .,"black: evil, bad, unsavory",0
"The Haiku Buckaroo ) will receive a Magnetic Poetry Haiku Kit , a Haiku Buckaroo Mug and a super - [cool] button for their blog ( in their choice of white or black ) .",cool: of or at a relatively low temperature,0
"If there is a light - weight , the blue wire should be connected towards the [black] wire of your swap likewise .","black: evil, bad, unsavory",0
The mold is typically [hard] to identify .,"hard: Firm, solid, resistant to pressure, tangible",0
"While a [cool] find , it 's missing the most key part to a Whizzer , the drive mechanism .",cool: of or at a relatively low temperature,0
It has [black] yarn and a fluffy white feather on top of the head .,"black: evil, bad, unsavory",0
Any business owner can tell you how [hard] it can be to think about marketing when you are inundated with company growth and the challenges that come along with that growth .,"hard: Firm, solid, resistant to pressure, tangible",0
"I come from at least four generations of brick masons dating back to 19th century Italy , and I learned the value of [hard] work and perseverance from working on construction sites with my father every summer from high school through medical school .","hard: Firm, solid, resistant to pressure, tangible",0
"Even as a diehard lover of the fantasy sci - fi schtick that Warhammer 40 K is peddling , I found the ‘ magical item is prophesised to destroy the world so we have to all kill each over it ’ storyline a little [hard] to look at uncritically .","hard: Firm, solid, resistant to pressure, tangible",0
"Hoy – True , I was a bit apprehensive about doing the first trip just because I did n’t know what to expect , but once I did it , I was so stoked not only with the waves and the resort , but with all the [cool] people I met and the good times we had .",cool: of or at a relatively low temperature,0
"In fact , we have one of the largest mobile [hard] drive shredding operations in the nation .","hard: Firm, solid, resistant to pressure, tangible",1
it is also [hard] when we all have a little bit of competitiveness in us ( sometimes we can be competitive ) and we want to be up the front winning not the last one to finish - this may cause i to rush and not do things properly .,"hard: Firm, solid, resistant to pressure, tangible",0
Tostada Salad - comes with choice of refried or [black] beans .,"black: evil, bad, unsavory",0
"They have a very [hard] time figuring out that technology can sometimes have unexpected bad consequences , not to mention fully intended bad consequences like putting people out of work .","hard: Firm, solid, resistant to pressure, tangible",0
"To wire the enthusiast , it is really merely a matter of connecting the [black] wire from the ceiling fan into the black wire with the swap .","black: evil, bad, unsavory",0
Beautiful white [black] glass wood modern design elegant .,"black: evil, bad, unsavory",0
"Jason Van Dyke , the former Chicago cop whose fatal 2014 shooting of [black] teenager Laquan McDonald reignited the fervent nationwide conversation about police shootings , was sentenced Friday to six years and nine months in prison .","black: evil, bad, unsavory",0
I find that it 's very [hard] to explain without pics .,"hard: Firm, solid, resistant to pressure, tangible",0
"And when that happens I try to get creative with neutrals like [black] , white and grey .","black: evil, bad, unsavory",0
It ’s [hard] to bring home the bacon on tests these days .,"hard: Firm, solid, resistant to pressure, tangible",0
Next you add items that are related to the incident such as the [hard] disk or floppies .,"hard: Firm, solid, resistant to pressure, tangible",1
"I ’ll give you the recipes I improvise from , but seriously pancakes are [hard] to mess up .","hard: Firm, solid, resistant to pressure, tangible",0
It has thumbholes and is perfect for a [cool] day !,cool: of or at a relatively low temperature,1
I almost always skipped this step because I always thought using a cleanser gave my skin a really [hard] time .,"hard: Firm, solid, resistant to pressure, tangible",0
I particularly like the [cool] 812.5 years ROI on double glazing .,cool: of or at a relatively low temperature,0
The [hard] places discipline us under His careful watch and lead us to say yes to His yes instead of shaking our heads in defiance .,"hard: Firm, solid, resistant to pressure, tangible",0
"The most popular color of the Bengal is the brown / black tabby , a lackluster description for coats that can be anywhere from a [cool] grey to vibrant shades of golden , bronze , copper or mahogany with spots or marbling ranging from rich browns to intense black .",cool: of or at a relatively low temperature,1
Tiny Gold Concentration Machine for [hard] rock gold mine mining .,"hard: Firm, solid, resistant to pressure, tangible",1
"It is [hard] for us as Americans to feel as much pain on Sept. 11 when remembering the attacks that happened 15 years ago , because similarly awful terrorist attacks are occurring in the present .","hard: Firm, solid, resistant to pressure, tangible",0
It is really modern and just a [cool] atmosphere - just what I like .,cool: of or at a relatively low temperature,0
"This film is very much geared towards the U.S. falling on [hard] times , but I think the real question for us is what happens when China falls on hard times , and I think that 's likely to happen fairly soon .","hard: Firm, solid, resistant to pressure, tangible",0
"Notes of blueberry , blackberry , smoked meat , and vanilla are found on the nose along with flavors of [black] cherry , blackberry compote , cinnamon , black pepper and vanilla on the palate .","black: evil, bad, unsavory",0
"Phenotypically , the Parkote buffalo are dark in coat color and medium built body size , with sword - shaped horns directed laterally or towards the back of the body ( Rasali , 1998 ; Pradhan et al . , 1996).They have black coat color ; [black] skin color ; black muzzle ; black eye brow ; usually no leg markings ; and chevron marks absent ( Rasali et al . , 1998 ) .","black: evil, bad, unsavory",0
"Sure , you can score a few kills for yourself by going it alone , but all you Rambo types are going to have a [hard] time being an effective part of the larger offensive unless you learn to coordinate with your squadmates .","hard: Firm, solid, resistant to pressure, tangible",0
A [cool] city and a great store .,cool: of or at a relatively low temperature,0
"That was just the cool part , the really [cool] part ?",cool: of or at a relatively low temperature,0
"The dual - processor system is an awesome machine , especially when you consider that its predecessor , which sported two 800MHz processors , cost $ 500 more , with half the RAM , a smaller - capacity [hard] disk , and a lesser video card .","hard: Firm, solid, resistant to pressure, tangible",1
"If the lice are allowed to continue breeding , the outbreak of lice will become [hard] to stop .","hard: Firm, solid, resistant to pressure, tangible",0
"It is part of the Plympton Community Magazine guarantee that all materials are pushed completely through each and every letterbox , both for security purposes and to help keep [cool] homes cool , and warm homes warm .",cool: of or at a relatively low temperature,1
The booklet comes in plain [black] and white while the pictures themselves play with close ups and the typical Haw - lin smiley in the distance .,"black: evil, bad, unsavory",0
"Their communication primarily comes from body language : they 'll turn their head or body away to indicate they 're not so [cool] with this invasion , or they may even try to move away .",cool: of or at a relatively low temperature,0
"Once you ’ve stopped the bleeding , rinse the cut under [cool] running water or use a saline wound wash .",cool: of or at a relatively low temperature,1
"Also , the men seemed to be very partial to [black] tee shirts .","black: evil, bad, unsavory",0
It was very [hard] as I yelled to him to stay put until I got over to him .,"hard: Firm, solid, resistant to pressure, tangible",0
He is meant to have helped Jimmy 's family long ago but it 's still [hard] to sympathise with him and the film is less involving because of that .,"hard: Firm, solid, resistant to pressure, tangible",0
The 13 - member Boston City Council in January will have four black councilors and Andrea Campbell is poised to take the gavel as the first [black] City Council president since 2001 .,"black: evil, bad, unsavory",0
"When you sign up we will ask if you have the following : black pants , [black] t - shirt , dark suit jacket or blazer , good dark colored walking shoes .","black: evil, bad, unsavory",0
"Before buying a hard drive , you need to be sure of the type of [hard] drive that you want to purchase .","hard: Firm, solid, resistant to pressure, tangible",1
The really neat thing about the truss system is the [cool] special truss hanger that is used to nail all eight trusses together .,cool: of or at a relatively low temperature,0
Recording is hard work in any era but it was especially [hard] in this era .,"hard: Firm, solid, resistant to pressure, tangible",0
"In 1999 , the working group "" Hard metals "" of the German industrial union for powder metallurgy suggested a classification of WC - Co [hard] metals according to grain size , which is today accepted worldwide .","hard: Firm, solid, resistant to pressure, tangible",1
"I checked the 3way switch on the other side of the room , and it has a [black] going to the common terminal , a white to one of the travelers , and a red to the other traveler .","black: evil, bad, unsavory",0
"This new trick is so very [cool] that when he 's not doing it in his crib , he will run around the house and hide from me as he snorts .",cool: of or at a relatively low temperature,0
"Mad Men is always aware of its own bigness ; it 's deep , but it 's also [cool] and crowd - pleasing .",cool: of or at a relatively low temperature,0
I looked them over and it seems I got a couple of [cool] ones .,cool: of or at a relatively low temperature,0
It is [hard] enough to struggle to become the sorts of person we would hope to be .,"hard: Firm, solid, resistant to pressure, tangible",0
Different types of pen drives and [hard] drives at discounted rates .,"hard: Firm, solid, resistant to pressure, tangible",1
I tried starting the computer in low- res mode but the same thing happened : the Windows logo comes up then the [black] screen with a centered mouse cursor .,"black: evil, bad, unsavory",0
